{
  "schema_version": 1,
  "observed_at": "2026-10-30T00:00:00Z",
  "evaluated_at": "2026-10-30T00:00:00Z",
  "freshness_limit_seconds": 3600,
  "recorded_by": {
    "actor_type": "human",
    "actor_ref": "example-user"
  },
  "source": {
    "kind": "url",
    "target": "https://github.com/example/project/issues/1#issuecomment-1"
  },
  "human_owner": "example-user",
  "agent_ref": "codex-a",
  "principal": {
    "credential_kind": "human",
    "authenticated_login": "example-user",
    "on_behalf_of": null,
    "evidence": {
      "kind": "url",
      "target": "https://github.com/example/project/issues/1#issuecomment-1"
    },
    "delegation": {
      "state": "unknown",
      "evidence": null
    }
  },
  "member_facts": [
    {
      "github_login": "example-user",
      "account_type": "human",
      "evidence": {
        "kind": "url",
        "target": "https://github.com/example/project/issues/42#issuecomment-1"
      },
      "repository_access": {
        "state": "confirmed",
        "permission": "write",
        "evidence": {
          "kind": "url",
          "target": "https://github.com/example/project/issues/42#issuecomment-1"
        }
      },
      "organization_team": {
        "state": "not_applicable",
        "organization": null,
        "team_slug": null
      }
    }
  ],
  "claims_inventory_status": "complete",
  "active_claims": [],
  "instruction": {
    "state": "proceed",
    "evidence": {
      "kind": "url",
      "target": "https://github.com/example/project/issues/1#issuecomment-1"
    }
  },
  "requested_issue_ref": null,
  "candidate_limit": 3,
  "issue_facts": [
    {
      "issue_ref": "https://github.com/example/project/issues/1",
      "work_id": "issue-1",
      "area_ids": [
        "backend"
      ],
      "file_scope": [
        "packages/backend/src"
      ],
      "non_scope": [
        "packages/backend/private"
      ],
      "contract": {
        "acceptance": {
          "state": "confirmed",
          "evidence": {
            "kind": "url",
            "target": "https://github.com/example/project/issues/1#issuecomment-1"
          }
        },
        "non_scope": {
          "state": "confirmed",
          "evidence": {
            "kind": "url",
            "target": "https://github.com/example/project/issues/1#issuecomment-1"
          }
        }
      },
      "approval": {
        "state": "confirmed",
        "evidence": {
          "kind": "url",
          "target": "https://github.com/example/project/issues/1#issuecomment-1"
        }
      },
      "responsibility_confirmation": {
        "state": "confirmed",
        "evidence": {
          "kind": "url",
          "target": "https://github.com/example/project/issues/1#issuecomment-1"
        }
      },
      "owner_overrides": [],
      "scope_check": {
        "state": "clear",
        "evidence": {
          "kind": "url",
          "target": "https://github.com/example/project/issues/1#issuecomment-1"
        }
      },
      "execution_confirmation": {
        "state": "confirmed",
        "evidence": {
          "kind": "url",
          "target": "https://github.com/example/project/issues/1#issuecomment-1"
        },
        "claim_id": null,
        "agent_ref": null
      }
    }
  ],
  "project_id": "example-app",
  "repository": "example/project",
  "project_revision": 1,
  "plan_revision": 1,
  "team_revision": 1,
  "project_digest": "aaf63234e9b9af669a47a8d5e04af1768e5134c84b953226e4143ad0eb68b539",
  "plan_digest": "53c8b4edf59eb250b9860ddfaffbd7b87f4985d59aa42bb69cadfabe6170ca50",
  "team_digest": "d40c2d02f204e2ce39062e93460310234bb7db2fea4c1602f196dde9bb5b2d4c"
}
